{
  "schema_version": "0.1.0",
  "task_id": "harden-repo-map-ranking-仓库地图排序加固",
  "generated_at": "2026-03-18T05:29:38+00:00",
  "title": "Harden repo map ranking 仓库地图排序加固",
  "type": "refactor",
  "objective": "Improve candidate file ranking without expanding scope beyond repo-map logic. 在不扩大范围的前提下改进候选文件排序。",
  "scope": [
    "Touch repo-map and ranking logic only. 只改仓库地图与排序逻辑。"
  ],
  "non_goals": [],
  "acceptance_criteria": [
    "Repo map still generates JSON and Markdown. 仓库地图仍能生成 JSON 和 Markdown。",
    "Candidate ranking remains deterministic. 候选排序必须保持确定性。"
  ],
  "constraints": [
    "Do not add third-party dependencies. 不要引入第三方依赖。"
  ],
  "search_terms": [
    "ranking",
    "repo-map"
  ],
  "context_budget": {
    "seed_file_limit": 12,
    "candidate_file_limit": 10,
    "hard_file_cap": 24,
    "max_file_chars": 18000,
    "max_snippet_chars": 1200
  },
  "read_order": [
    "AGENTS.md",
    ".aidrp/repo-map.md",
    "src/aidrp/repo_map.py",
    "README.md",
    "src/aidrp/cli.py",
    "src/aidrp/debug_pack.py",
    "templates/task-packet-任务包.md",
    "src/aidrp/task_packet.py",
    "tests/test_runtime_protocol.py",
    "AGENTS.md",
    "ONBOARDING.md",
    "adapters/react-node-monorepo-适配器.md"
  ],
  "candidate_files": [
    {
      "path": "src/aidrp/repo_map.py",
      "language": "python",
      "role": "source",
      "score": 21,
      "reason": "Matched tokens: and, candidate, map, repo"
    },
    {
      "path": "README.md",
      "language": "markdown",
      "role": "documentation",
      "score": 16,
      "reason": "Matched tokens: map, repo"
    },
    {
      "path": "src/aidrp/cli.py",
      "language": "python",
      "role": "source",
      "score": 15,
      "reason": "Matched tokens: map, repo"
    },
    {
      "path": "src/aidrp/debug_pack.py",
      "language": "python",
      "role": "source",
      "score": 15,
      "reason": "Matched tokens: map, repo"
    },
    {
      "path": "templates/task-packet-任务包.md",
      "language": "markdown",
      "role": "source",
      "score": 15,
      "reason": "Matched tokens: and, candidate, scope"
    },
    {
      "path": "src/aidrp/task_packet.py",
      "language": "python",
      "role": "source",
      "score": 14,
      "reason": "Matched tokens: map, repo"
    },
    {
      "path": "tests/test_runtime_protocol.py",
      "language": "python",
      "role": "test",
      "score": 12,
      "reason": "Matched tokens: map, repo"
    },
    {
      "path": "AGENTS.md",
      "language": "markdown",
      "role": "documentation",
      "score": 10,
      "reason": "High-signal documentation file"
    },
    {
      "path": "ONBOARDING.md",
      "language": "markdown",
      "role": "documentation",
      "score": 10,
      "reason": "High-signal documentation file"
    },
    {
      "path": "adapters/react-node-monorepo-适配器.md",
      "language": "markdown",
      "role": "source",
      "score": 9,
      "reason": "Matched tokens: repo"
    }
  ],
  "validation_commands": {
    "npm": [],
    "python": [
      "aidrp"
    ],
    "make": []
  },
  "deliverables": [
    "Code changes scoped to the task",
    "Updated or new tests for changed behavior",
    "Decision trace for major tradeoffs",
    "Follow-up notes for unresolved risks"
  ]
}
